{
  "schema_version": "1.0",
  "context_id": "context_demo_001",
  "context_created_at": "2026-07-30T10:00:00Z",
  "plan_context": {
    "schema_version": "1.0",
    "plan_id": "plan_demo_001",
    "source": "DEMO_OPTIMIZER_STUB",
    "source_version": "1.0",
    "period": {
      "type": "next_14_days",
      "start_date": "2026-08-01",
      "end_date": "2026-08-14"
    },
    "items": [
      {
        "plan_item_id": "plan_item_001",
        "entity_type": "channel",
        "entity_id": "Sponsored Products",
        "action": "increase_budget",
        "delta_pct": 10,
        "current_budget": 1000,
        "recommended_budget": 1100,
        "currency": "USD"
      }
    ],
    "decision_evidence": [
      {
        "fact_id": "decision_fact_001",
        "plan_item_id": "plan_item_001",
        "entity_type": "channel",
        "entity_id": "Sponsored Products",
        "name": "predicted_roas",
        "value": 4.2,
        "unit": "ratio",
        "period": "next_14_days",
        "source": "demo_prediction_output",
        "scope": "public_output"
      }
    ],
    "review_evidence": [
      {
        "fact_id": "review_fact_001",
        "plan_item_id": "plan_item_001",
        "entity_type": "channel",
        "entity_id": "Sponsored Products",
        "name": "contribution_share",
          "value": 0.08,
        "unit": "ratio",
        "period": "current_snapshot",
        "source": "demo_mta_output",
        "scope": "ontology_review"
      },
      {
        "fact_id": "review_fact_002",
        "plan_item_id": "plan_item_001",
        "entity_type": "channel",
        "entity_id": "Sponsored Products",
        "name": "spend_share",
        "value": 0.28,
        "unit": "ratio",
        "period": "current_snapshot",
        "source": "demo_platform_output",
        "scope": "ontology_review"
      },
      {
        "fact_id": "review_fact_003",
        "plan_item_id": "plan_item_001",
        "entity_type": "channel",
        "entity_id": "Sponsored Products",
        "name": "attribution_divergence",
        "value": 0.03,
        "unit": "ratio",
        "period": "current_snapshot",
        "source": "demo_mta_comparison",
        "scope": "ontology_review"
      }
    ]
  },
  "review_context": {
    "schema_version": "1.0",
    "review_id": "review_demo_001",
    "plan_id": "plan_demo_001",
    "source": "DEMO_ONTOLOGY_STUB",
      "ontology_version": "ontology-demo-2026-08-03-review-only",
      "release_identity": {
        "ontology_version": "ontology-demo-2026-08-03-review-only",
        "rule_version": "R5@1.3-contract-hardening",
        "engine_version": "1.3",
        "schema_version": "1.0",
        "source_commit": "b90391ed77bbe3ce3f10bb929688db32f7627984",
        "package_checksum": "b55acbd631edaa26b0df947c29ed37605e30f1d16c97198e45b6ce993a830d8f"
      },
      "confidence_state_version": "feedback-demo-v1",
    "is_synthetic": true,
      "overall_verdict": "CONFLICT",
    "items": [
      {
        "review_item_id": "review_item_001",
        "plan_item_id": "plan_item_001",
          "verdict": "CONFLICT",
        "rule_id": "R5",
          "rule_version": "1.3-contract-hardening",
          "base_confidence": 0.62,
          "runtime_confidence": 0.62,
        "matched_fact_ids": [
          "review_fact_001",
          "review_fact_002",
          "review_fact_003"
        ],
        "missing_evidence": [],
          "missing_rule_parameters": [],
        "limitations": [
            "R5的10%、20%和5%均为Demo占位阈值，生产部署前必须重新标定",
          "R5使用MTA快照数据，而方案面向下一14天，时间粒度尚未完全对齐"
        ]
      }
    ]
  },
  "allowed_rule_ids": ["R5"],
  "allowed_plan_item_ids": ["plan_item_001"],
  "allowed_fact_ids": [
    "decision_fact_001",
    "review_fact_001",
    "review_fact_002",
    "review_fact_003"
  ],
  "public_rule_context": [
    {
      "rule_id": "R5",
      "rule_version": "1.3-contract-hardening",
      "status": "ACTIVE",
      "name": "低贡献高花费触点预算重分配审核",
      "definition": "该触点归因贡献份额低于10%，但花费份额高于20%，且 Markov 与 Shapley 的贡献份额差异不超过5%；若最终方案仍增加该触点预算，本体应标记冲突。",
      "applicable_scope": [
        "time=snapshot",
        "entity=channel"
      ],
      "review_policy": {
        "mode": "review_only",
        "supported_plan_actions": ["decrease_budget"],
        "conflicting_plan_actions": ["increase_budget"],
        "otherwise": "NOT_APPLICABLE"
      },
      "limitations": [
        "10%、20% 与 5% 均为 Demo 占位阈值，生产部署前必须用真实数据重新标定并经人工审批。",
        "三个输入必须来自同一报告窗口；缺少任一输入时返回证据不足或未覆盖，不得触发决定性评价。",
        "MTA snapshot 与下一14天方案存在时间粒度差异，评价中必须披露。"
      ]
    }
  ]
}
